id	title	current_author	primary_author	attribution_status	conflation	source	note
SA_GK19_kmeghdpu	Meghadūta	Kālidāsa	Kālidāsa	secure	False	gretil-header	Securely Kālidāsa per colophon. Plain text of the poem only (no commentary).
SA_GK20_ksakunpu	Abhijñānaśākuntala	Kālidāsa	Kālidāsa	secure	False	gretil-header	Securely Kālidāsa. Bare play text (Kale recension); commentary not embedded in this e-text.
SA_K10_dvtasutu	Devatāsūtra	anonymous/traditional	anonymous (canonical Buddhist sūtra; ed. A. Mette)	anonymous	False	gretil-header; secondary:cleaned_(Mahā-)Karmavibhanga quotation notes (Kudo)	Anonymous Buddhist canonical sūtra; no traditional named author. Edition/input figures noted as editor/redactor roles, not composers.
SA_GK19_ragh	Raghuvaṃśa	Kālidāsa	Kālidāsa (kāvya); Vallabhadeva (Raghupañcikā commentary)	secure	True	gretil-header; secondary:cleaned_(Meghadūta commentary studies, Vallabhadeva 10th c.)	Root verses securely Kālidāsa; the edition this e-text derives from is Vallabhadeva's commentary, a distinct author/role. Conflation: poet vs commentator.
SA_GK19_kmeghvpu	Meghadūta	Kālidāsa	Kālidāsa (kāvya); Vallabhadeva (commentary)	secure	True	gretil-header; secondary:cleaned_(Meghadūta translation/commentary study)	Root poem securely Kālidāsa; e-text edition bundles Vallabhadeva's commentary (distinct author). Conflation: poet vs commentator.
SA_GK19_meghdk_u	Meghadūta	Kālidāsa	Kālidāsa (kāvya); Mallinātha (Sañjīvanī commentary)	secure	True	gretil-header; secondary:cleaned_(Meghadūta commentary study, Mallinātha 14th-15th c.)	Root poem securely Kālidāsa; Kale edition is the one with Mallinātha's 14th-c. commentary (distinct author). Conflation: poet vs commentator.
SA_GK19_kalrs_pu	Ṛtusaṃhāra	Kālidāsa (attributed)	Kālidāsa (traditional, disputed)	disputed	False	gretil-header; secondary:cleaned_Literary/encyclopedia sources + Kale Introduction	Traditional ascription to Kālidāsa is widely doubted; alternative ascription to Kumāradāsa in Śārṅgadhara-paddhati. Status: disputed, not secure.
SA_GK19_kakumspu	Kumārasambhava	Kālidāsa	Kālidāsa (cantos I-VIII genuine)	secure	False	gretil-header; secondary:cleaned_Kale Introduction (cantos IX-XVII not genuine)	Cantos I-VIII securely Kālidāsa. The non-genuine cantos IX-XVII (later author) are not in this e-text, so no conflation here; flagging the authenticity boundary for the title generally.
SA_GK19_kragh_pu	Raghuvaṃśa	Kālidāsa	Kālidāsa	secure	False	secondary:cleaned_skt-en-mono.txt; gretil-header	Single-author mahākāvya, attribution secure. The edition is a text-only extract from a lexicon, no commentary bundled.
SA_GR13_pasupbhu	Pāśupatasūtra	attributed to Lakulīśa	Lakulīśa (traditional)	traditional	False	secondary:cleaned_Encyclopedia of Tantra; secondary:cleaned_Ritual and Speculation in Early Tantrism (Goudriaan)	Sūtra traditionally ascribed to Lakulīśa, founder of the Pāśupata/Lakulīśa-Pāśupata school; legendary/traditional ascription, not documentarily secure. Pañcārthabhāṣya commentary (by Kauṇḍinya) is a SEPARATE text and not part of this sūtra item — no conflation within this record.
SA_GS26_sbhami_u	Āptamīmāṃsā [Devāgamastotra]	Samantabhadra	Samantabhadra	secure	False	secondary:cleaned_Character of Logic in India; secondary:cleaned_History of the Mediaeval School of Indian Logic	Root kārikās by Samantabhadra. Later commentaries (Akalaṅka's Aṣṭaśatī, Vidyānanda's Aṣṭasāhasrī) are separate works and not part of this text item; no conflation.
SA_K10_bsu036_u	Saddharmapuṇḍarīkasūtra	anonymous/traditional	anonymous (composite Mahāyāna sūtra)	anonymous	False	secondary:cleaned_Karashima_Who composed the Lotus Sutra.txt; web:https://encyclopediaofbuddhism.org/wiki/Saddharmapu%E1%B9%87%E1%B8%8Dar%C4%ABkas%C5%ABtra	Anonymous; traditional ascription to the Buddha (Śākyamuni). Composite/stratified by multiple anonymous redactors, but no NAMED distinct authors to enumerate, so conflation_flag=false (no identifiable conflated persons). Anonymous authors stand collectively.
SA_K01_bsu011_u	Bodhisattvaprātimokṣasūtra	anonymous/traditional (Mahāyāna)	anonymous (Mahāyāna sūtra)	anonymous	False	gretil-header; secondary:cleaned_Prebish_Text and Tradition in the Study of Buddhist Ethics.txt	Anonymous Mahāyāna sūtra (buddhavacana by tradition). Dutt = modern editor only. No conflation of distinct authors.
SA_T06_bsa073_u	Ratnagotravibhāga [Mahāyānottaratantraśāstra / Uttaratantra]	Maitreya (verses, per Tibetan tradition) / Sāramati (per Chinese tradition); commentary ascribed to Asaṅga — disputed	Maitreya (kārikā, Tibetan tradition); Asaṅga (vyākhyā, Tibetan tradition) / Sāramati (whole work, Chinese tradition)	conflated	True	secondary:cleaned_Indian Buddhism (Nakamura); web:https://en.wikipedia.org/wiki/Ratnagotravibh%C4%81ga; gretil-header	Classic multi-author/conflation case (parallel to Mahāyānasūtrālaṅkāra). The single GRETIL title bundles kārikās + vyākhyā by different ascribees: per Tibetan tradition kārikā=Maitreya, vyākhyā=Asaṅga; per Chinese tradition the whole=Sāramati. Attributions unresolved/disputed across traditions; roles separated here.
SA_K14_sf259_sc				anonymous	False	tradition	Empty record; no metadata to triangulate. Treated as anonymous/unidentified fragment.
SA_T08_sghancsu	Śrīghanācārasaṃgraha	anonymous/traditional	anonymous (Mahāsāṃghika root saṃgraha); reconstructed by Sanghasena Singh from Jayarakṣita's ṭīkā	anonymous	True	secondary:cleaned_Survey of Vinaya Literature Vol.1_Charles S. Prebish, 1994.txt	Multi-layer: anonymous root saṃgraha (Mahāsāṃghika), ṭīkā by Jayarakṣita, modern reconstruction by Sanghasena Singh. Root author distinct from commentator Jayarakṣita.
SA_K10_samghscu	Saṃghāṭasūtra [Saṅghāṭasūtra]	anonymous/traditional	anonymous (Mahāyāna sūtra; framed as discourse of the Buddha)	anonymous	False	gretil-header	Anonymous Mahāyāna sūtra; traditional speaker = Buddha, interlocutor Sarvaśūra. No human authorship.
SA_GP12_mtp176pu	Matsya-Purāṇa	anonymous/traditional (ascribed to Vyāsa)	anonymous; traditionally ascribed to Vyāsa (narrated by Sūta)	traditional	False	gretil-header	Traditional Vyāsa ascription (low confidence); in reality an anonymous, multi-layered compilation. Matches current_author.
SA_K14_bsu015_u	Ekādaśamukha	anonymous/traditional	anonymous (dhāraṇī text; framed as revealed by Avalokiteśvara)	anonymous	False	gretil-header	Anonymous Avalokiteśvara dhāraṇī (Ekādaśamukha/Eleven-Faced); traditional speaker = Avalokiteśvara.
SA_GSP33_bbdip12u	Brahmasūtra: Adhyāya 1, Pāda 2	Bādarāyaṇa (Vyāsa, traditional)	Bādarāyaṇa (sūtra); Madhva (bhāṣya); Jagannāthayati (ṭippaṇī)	conflated	True	gretil-header	One title conflates three distinct authors: root sūtra (Bādarāyaṇa), bhāṣya (Madhva), ṭippaṇī (Jagannāthayati). current_author lists only the root sūtra author.
SA_GK19_ksyadndu	Śyāmalādaṇḍaka	Kālidāsa (traditionally attributed)	Kālidāsa (traditionally attributed; spurious per modern scholarship)	pseudepigraphic	False	gretil-header; web:https://en.wikipedia.org/wiki/Kalidasa; web:https://www.ebsco.com/research-starters/biography/kalidasa	Edition asserts Kālidāsa, but the attribution is traditional/spurious; a devotional stotra-daṇḍaka to Śyāmalā (Mātaṅgī), not securely by the classical Kālidāsa. current_author already flags 'traditionally attributed'.
SA_T10_cansisy2	Śiṣyalekha (alternate)	Candragomin	Candragomin	secure	False	gretil-header; tradition	Verse letter of instruction to a pupil; attribution to Candragomin (c. 5th-7th c.) is uncontested. Distinct from Candragomin's grammatical works.
SA_T04_bsa058_u	Bhavasaṅkrāntiṭīkā	Maitreyanātha (attributed; commentator on Nāgārjuna's Bhavasaṅkrānti)	Maitreyanātha (ṭīkā); Nāgārjuna (root Bhavasaṅkrānti kārikā/śāstra)	conflated	True	gretil-header; secondary:cleaned_Indian Buddhism. A Survey With Bibliographical Notes_Hajime Nakamura, 1980.txt; secondary:cleaned_Nagarjuna's Philosophy..._K. Venkata Ramanan, 1966, 1987.txt; web:https://www.worldcat.org/title/oclc/959252	Two distinct authors conflated: root Bhavasaṅkrānti (kārikā/śāstra) ascribed to Nāgārjuna; the ṭīkā/bhāṣya by Maitreyanātha. Both attributions themselves debated, but the multi-author root-vs-commentary structure is the key correction. current_author named only the commentator.
SA_K10_nidansyu	Nidānasaṃyukta	anonymous/traditional	anonymous (canonical Sūtrapiṭaka material; redacted Sarvāstivāda/Mūlasarvāstivāda)	anonymous	False	gretil-header; tradition	Anonymous canonical āgama text (Turfan Sanskrit fragments); traditionally buddhavacana. No individual author; matches current 'anonymous/traditional'.
SA_T09_hjatm	Jātakamālā	Haribhaṭṭa	Haribhaṭṭa	secure	False	gretil-header; secondary:cleaned_Brief History of Buddhist Studies in Europe and America_J. M. de Jong, 1987.txt; secondary:cleaned_Buddha and the Shape of Belief..._Leela Aditi Wood, 2005.txt	Distinct from Āryaśūra's (Ārya Śūra's) more famous Jātakamālā, which Haribhaṭṭa took as model. Author secure (Haribhaṭṭa); transmission partly via Tibetan, edition reconstructed by Hahn.
SA_GV05_agsas_1u	Āgamaśāstra 1: Āgamaprakaraṇa	Gauḍapāda	Gauḍapāda (kārikā, book 1); Māṇḍūkya Upaniṣad mantras (anonymous śruti, interleaved); Śaṅkara (commentary)	conflated	True	gretil-header; secondary:cleaned_Early Advaita Vedanta and Buddhism. Mahayana Context of  Gaudapadiya-karika_Richard King, 1995.txt	This file (Āgamaprakaraṇa, book 1) conflates: anonymous Māṇḍūkya Upaniṣad śruti mantras + Gauḍapāda's kārikās + Śaṅkara's bhāṣya. Authorship of GK as a whole disputed (Bhattacharya/King: composite, four prakaraṇas possibly distinct authors); 'Gauḍapāda' itself a quasi-legendary paramaguru figure. Book 1 attribution to Gauḍapāda is the least contested of the four.
SA_GP12_vipce_pu	Viṣṇu-Purāṇa	anonymous/traditional (ascribed to Parāśara, related to Vyāsa)	anonymous (traditionally narrated by Parāśara to Maitreya)	traditional	False	gretil-header	Traditional/legendary ascription to Parāśara is a narrative frame, not historical authorship; text is an anonymous redacted compilation.
SA_T17_bsa007_u	Dharmasaṃgraha	attributed to Nāgārjuna (traditional; authorship uncertain)	attributed to Nāgārjuna (disputed / likely inauthentic)	disputed	False	secondary:cleaned_Dispeller of Disputes. Nagarjunas Vigrahavyavartani_Jan Westerhoff, tr., 2010.txt	Colophon names Nāgārjuna but scholars (Lindtner) consider it spurious; a short glossary of Buddhist technical terms attributed to one of several 'Nāgārjunas'.
SA_K10_n206u	Avikalpapraveśadhāraṇī [Avikalpapraveśadhāraṇīsūtra]	anonymous/traditional	anonymous	anonymous	False	tradition	Anonymous sūtra; no authorial colophon. Traditionally buddhavacana.
SA_K10_bsu019	Kāraṇḍavyūha Sūtra [Avalokiteśvaraguṇa-Kāraṇḍavyūha(sūtra)]	anonymous/traditional	anonymous	anonymous	False	gretil-header	Anonymous Mahāyāna sūtra (prose recension); not to be conflated with the later verse Guṇakāraṇḍavyūha, a separate title.
SA_T14_nagcitpu	Citralakṣaṇa	Nagnajit (traditional attribution)	anonymous (frame ascribed to Nagnajit; chapters ascribed variously to Nagnajit, Viśvakarman/Brahmā, Prahlāda)	uncertain	True	secondary:cleaned_Ruegg_Ordre spirituel et ordre temporel.txt	Title conflates a multi-chapter work whose chapters bear different (legendary) ascriptions — only ch.1 to Nagnajit per Ruegg; Nagnajit may be the narrative recipient, not author. Original Sanskrit lost; extant via Tibetan.
SA_GSD36_yssoutpu	Yamasmṛti	anonymous/traditional (ascribed to the sage Yama)	anonymous (traditionally ascribed to the sage Yama)	traditional	False	gretil-header	Legendary ascription to the god Yama; an anonymous Dharmaśāstra smṛti transmitted in variable recensions.
SA_K01_vinv05_u	Carmavastu	anonymous/traditional (Mūlasarvāstivāda Vinaya)	anonymous (canonical Mūlasarvāstivāda Vinaya compilation)	anonymous	False	gretil-header; secondary:cleaned_Survey of Vinaya Litterature_Prebish, 1994.txt	Canonical Vinaya text, no individual author; traditionally ascribed to the Buddha/monastic transmission. Modern editor N. Dutt; digital input K. Wille.
SA_K10_sf258_sc			anonymous (unidentified Sanskrit fragment)	anonymous	False	tradition	Unidentified Turfan/SHT Sanskrit fragment (sf258); no work-title or author recoverable. Editor Klaus Wille.
SA_T10_subhrk_u	Subhāṣitaratnakaraṇḍakathā	attributed to Āryaśūra (also given as Śūra/Aśvaghoṣa; uncertain)	Āryaśūra (per colophon; identity/dating uncertain — distinct from the classical Jātakamālā Āryaśūra)	uncertain	False	gretil-header; web:https://ancient-buddhist-texts.net/Reference/Literary-History-of-Sanskrit-Buddhism/05-Asvaghosa.htm	Colophon ascribes to Āryaśūra; alternative ascriptions Śūra/Aśvaghoṣa; Hahn treats it as a late text — identity of this 'Āryaśūra' and the rival Aśvaghoṣa ascription leave attribution uncertain, but a single author (not a conflation of roles).
SA_GSP33_bbdip13u	Brahmasūtra: Adhyāya 1, Pāda 3	Bādarāyaṇa (Vyāsa, traditional)	Bādarāyaṇa (sūtra); Madhva/Ānandatīrtha (bhāṣya); Jagannātha-yati (ṭippaṇī/dīpikā)	conflated	True	gretil-header	Single GRETIL title bundles three distinct authors across three layers (sūtra/bhāṣya/dīpikā); current_author lists only Bādarāyaṇa — the Madhva bhāṣya and Jagannātha dīpikā are separate authors.
SA_K10_sf107_sc			anonymous (unidentified Sanskrit fragment)	anonymous	False	tradition	Unidentified Turfan/SHT Sanskrit fragment (sf107); no work-title or author recoverable. Editor Klaus Wille.
SA_K10_bsu045_u	Saṃghāṭa Sūtra	anonymous/traditional	anonymous (Mahāyāna sūtra, traditionally Buddhavacana)	anonymous	False	gretil-header	Anonymous Mahāyāna sūtra, traditionally Buddhavacana; no individual author. Critical editor Oskar von Hinüber.
SA_T13_n2940u	Triratnasaundaryagāthā		anonymous	anonymous	False	gretil-header	Anonymous Buddhist devotional gāthā in praise of the Three Jewels; colophon gives no author/scribe. No traditional ascription found.
SA_GP12_mkp1-93u	Mārkaṇḍeya-Purāṇa	anonymous/traditional (ascribed to Vyāsa)	anonymous (traditionally ascribed to Vyāsa; narrated by sage Mārkaṇḍeya)	traditional	False	gretil-header	Conventional Vyāsa ascription is legendary, not a real conflation of distinct historical authors; text is anonymous composite. Mārkaṇḍeya = in-text narrator persona.
SA_K10_sf253_sc			anonymous	anonymous	False	secondary:cleaned_review_SHT_Klaus_Wille / gretil-corpus	Anonymous unidentified Buddhist manuscript fragment; Wille is editor, not author. No work-title recoverable from item data.
SA_K12_n221u	Ṣaṇmukhīdhāraṇī	anonymous/traditional	anonymous (canonical dhāraṇī)	anonymous	False	web:https://84000.co/translation/toh526?part=introduction	Root dhāraṇī anonymous. Commentarial attributions (Vasubandhu vyākhyāna; Jñānadatta subcommentary) belong to distinct texts not present here — so no conflation within this item.
SA_GK20_sypadatu	Pāḍatāḍitaka	Udīcya Śyāmilaka (Śyāmilaka)	Śyāmilaka (Āryaśyāmilaka, son of Viśveśvaradatta)	secure	False	secondary:cleaned_Verardi_Hardships_and_Downfall_of_Buddhism_in_India.txt	Single-author bhāṇa; secure attribution to Śyāmilaka. Title spelled 'Pāḍatāḍitaka' in item = Pādatāḍitaka. Variant author-name Saumillaka noted but Śyāmilaka standard.
SA_K12_ekmuhr_u	Ekādaśamukhahṛdaya	anonymous/traditional	anonymous (canonical dhāraṇī of the Eleven-Faced Avalokiteśvara)	anonymous	False	gretil-header	Anonymous dhāraṇī text from the Gilgit corpus; S. Vasudeva is e-text inputter only. No author/scribe in colophon; traditional buddhavacana.
SA_MB_pranagnihotraHK	Prāṇāgnihotra (Prāṇāgnihotra Upaniṣad)	anonymous/traditional	anonymous (minor Upaniṣad; Vedic tradition)	anonymous	False	gretil-header | secondary:cleaned_Literature about the Philosophical Systems and Indian Philosophy.txt | web:https://sanskritdocuments.org/doc_upanishhat/pranagni.itx	Root Upaniṣad anonymous (traditional Buddha-word equivalent: 'Vedic'/śruti). Commentators are distinct later authors: Upaniṣad-brahmayogin (Adyar 108) and Nārāyaṇa (Dīpikā); these are separate roles, not conflated into one title here.
SA_K10_bsu034_u	Samādhirājasūtra	anonymous/traditional	anonymous (Mahāyāna sūtra; traditional Buddha-word)	anonymous	False	gretil-header | secondary:cleaned_Indian Buddhism. A Survey With Bibliographical Notes_Hajime Nakamura, 1980.txt | web:https://en.wikipedia.org/wiki/Samadhiraja_Sutra	Anonymous Mahāyāna sūtra, also called Samādhirāja-candrapradīpa-sūtra; layered compilation, no single human author. Traditionally Buddha-word.
SA_K10_uvs_sc			anonymous (unidentified; insufficient metadata)	anonymous	False	web:https://suttacentral.net/	Unresolvable: no title, no edition, generic portal URL. id 'SA_K10_uvs_sc' suggests a SuttaCentral-sourced item but the specific text is not specified. Left anonymous; no traditional ascription available.
SA_T02_n3006u	Boudhatantrokta Siddhauṣadhi Saṅgraha		anonymous (tantric compilation; no author stated)	anonymous	False	dsbc-header | web:https://www.dsbcproject.org/canon-text/content/811/3006	A saṅgraha (compilation) drawing material from Buddhist tantras (esp. Caṇḍamahāroṣaṇa-tantra); compiler unnamed. Anonymous; current_author already empty so no meaningful change.
SA_K14_amoghapu	Āmoghapāśanāmahṛdayasūtra [Āryāmoghapāśanāmahṛdayasūtra]	anonymous/traditional	anonymous (Mahāyāna dhāraṇī sūtra; traditional Buddha-word)	anonymous	False	gretil-header | web:http://gretil.sub.uni-goettingen.de/gretil/1_sanskr/4_rellit/buddh/amoghapu.htm	Anonymous Avalokiteśvara dhāraṇī sūtra. Same underlying text as SA_K14_bsu002_u but a different edition (CIHTS/Dhīḥ vs NIEM/Shakya); not multi-author, so no conflation.
SA_K14_bsu002_u	Āmoghapāśanāmahṛdaya sūtra [Ārya amoghapāśahṛdaya nāma mahāyānasūtra]	anonymous/traditional	anonymous (Mahāyāna dhāraṇī sūtra; traditional Buddha-word)	anonymous	False	gretil-header | web:http://gretil.sub.uni-goettingen.de/gretil/1_sanskr/4_rellit/buddh/bsu002_u.htm	Anonymous Avalokiteśvara dhāraṇī sūtra; M.B. Shakya is editor, not author. Same text as SA_K14_amoghapu in a different edition.
SA_GSD36_nars2_pu	Nāradasmṛti	anonymous/traditional (ascribed to the sage Nārada)	anonymous (traditionally ascribed to the sage Nārada)	pseudepigraphic	False	gretil-header	Traditional ascription to sage Nārada is eponymous/pseudepigraphic; actual compiler unknown. Edited (not authored) by R. W. Lariviere.
SA_GSD36_brhasp_u	Bṛhaspatismṛti	anonymous/traditional (ascribed to Bṛhaspati); modern reconstruction by K. V. Rangaswami Aiyangar	anonymous (ascribed to Bṛhaspati); reconstructed by K. V. Rangaswami Aiyangar	pseudepigraphic	False	gretil-header	Text does not survive as a unit; it is a modern reconstruction (Aiyangar) of an anonymous dharma text under the eponym Bṛhaspati. Only Vyavahārakāṇḍa digitised.
SA_K10_bsu021_u	Saddharmalaṅkāvatārasūtra [Laṅkāvatārasūtra]	anonymous/traditional	anonymous (Buddhavacana; no human author)	anonymous	False	gretil-header	Composite/compiled Mahāyāna sūtra (multiple recensions, interpolated Sagāthakam etc.), but redactors are unknown; remains anonymous Buddhavacana, not a conflation of named authors.
SA_T04_n1002u	Hastavālaprakaraṇavṛtti	attributed to Āryadeva (or Dignāga; authorship disputed)	Dignāga (probable; kārikā and auto-vṛtti) — Tibetan tradition ascribes to Āryadeva	disputed	False	secondary:cleaned_Indian Buddhism. A Survey With Bibliographical Notes_Hajime Nakamura, 1980.txt; web:https://en.wikipedia.org/wiki/Dign%C4%81ga	Disputed Dignāga (Chinese tradition, most scholars) vs Āryadeva (Tibetan colophon). Single author for both kārikā and vṛtti — not a multi-author conflation. Sanskrit is a Tucci reconstruction from Tib/Chi.
SA_GSD36_katy2p_u	Kātyāyanasmṛti [Kātyāyanasmṛtisāroddhāra]	anonymous/traditional (ascribed to Kātyāyana); reconstruction by P. V. Kane	anonymous (ascribed to Kātyāyana); reconstructed by P. V. Kane	pseudepigraphic	False	gretil-header	Modern reconstruction (Kane) of a lost anonymous dharma text under the eponym Kātyāyana; pseudepigraphic ascription, Kane as redactor/compiler.
SA_T07_vabhdiku	Abhidharmadīpakārikā	the anonymous 'Dīpakāra' (project hint 'Vimalamitra' unverified)	anonymous ('Dīpakāra')	anonymous	False	secondary:cleaned_Vasubandhu's Abhidharmakosa and the Commentaries Preserved in the Tanjur_Marek Mejor, 1991_OCR.txt; gretil-header	Author genuinely unknown ('Dīpakāra'); Vimalamitra/Iśvarasena/Saṅghabhadra are unverified scholarly guesses (Jaini rejects identification). GRETIL's 'Vimalamitra(?)' is tentative. Kept anonymous, not invented.
SA_T07_vabhdilu	Abhidharmadīpakārikā	the anonymous 'Dīpakāra' (project hint 'Vimalamitra' unverified)	anonymous (the 'Dīpakāra'; Vimalamitra ascription uncertain)	anonymous	False	gretil-header; secondary:cleaned_Vasubandhu. Three Aspects. Study of a Buddhist Philosopher_Stefan Anacker, 1970.txt	Author genuinely unknown; 'Dīpakāra' = epithet meaning 'author of the Dīpa'. Vimalamitra is a tentative, questioned identification only. GRETIL file = kārikās only (full bhāṣya Vibhāṣāprabhāvṛtti is separate); kārikā and vṛtti are by the same anonymous author per Jaini.
SA_GSD36_narads_u	Nāradasmṛti	anonymous/traditional (ascribed to the sage Nārada)	anonymous (traditionally ascribed to the sage Nārada)	traditional	False	gretil-header; tradition	Legendary ascription to the sage Nārada; no individual human author. Text exists in multiple recensions; current_author already correct.
SA_T06_sthtvbh	Triṃśikāvijñaptibhāṣya [Triṃśikābhāṣya]	Sthiramati	Sthiramati (bhāṣya); Vasubandhu (Triṃśikā kārikā)	conflated	True	gretil-header; secondary:cleaned_Indian Buddhism. A Survey With Bibliographical Notes_Hajime Nakamura, 1980.txt	The edited text embeds both works: root kārikā by Vasubandhu, bhāṣya by Sthiramati. current_author 'Sthiramati' is correct for the bhāṣya but conflates the two roles; recorded both.
SA_K10_bsu032_u	Sukhāvatyamṛtavyūha [Sukhāvatī(amṛta)vyūhasūtra], the Smaller Sukhāvatīvyūha	anonymous/traditional	anonymous (canonical Mahāyāna sūtra)	anonymous	False	gretil-header; tradition	Anonymous sūtra; no individual author. current_author already correct.
SA_T11_bsa002_u	Ālambanaparīkṣāvṛtti	Dignāga	Dignāga (Diṅnāga) — kārikā and autocommentary (vṛtti)	secure	False	gretil-header; secondary:cleaned_Philosophy in Classical India. The Proper Work of Reason_Jonardon Ganeri, 2001.txt	Single author Diṅnāga for both kārikā and vṛtti (svavṛtti). The Sanskrit is a restoration from Tibetan/Chinese (Aiyaswami Sastri 1942). Dharmapāla's commentary, named in the edition title, is a distinct work not contained in this file.
SA_K12_n283u	Bhaiṣajyaguruvaidūryaprabharājasūtra	anonymous/traditional	anonymous (canonical Mahāyāna sūtra)	anonymous	False	web:https://www.dsbcproject.org/canon-text/book/36; tradition	Anonymous sūtra; no individual author. current_author already correct.
SA_T03_bsa011_u	Prajñāpāramitāpiṇḍārtha	Dignāga	Dignāga (Diṅnāga)	secure	False	gretil-header; secondary:cleaned_Heart of Buddhist Philosophy. Dinnaga and Dharmakirti_Amar Singh, 1984.txt; web:Tucci 1947	Colophon names Dignāga; attribution undisputed. Editor/translator Tucci is editorial only, not an author role for the Sanskrit text.
SA_T06_pskvbhu	Pañcaskandhakavibhāṣā	Sthiramati	Sthiramati (vibhāṣā/commentary); on Vasubandhu's root Pañcaskandhaka	conflated	True	secondary:cleaned_Literature about the Philosophical Systems and Indian Philosophy.txt (Gokhale 175.11.1); secondary:cleaned_Stuart_Yogācāra Substrata.txt; secondary:cleaned_Candragomin and the Bodhisattva Vow_Tatz.txt	Two distinct authors by role: root mūla Pañcaskandhaka by Vasubandhu, vibhāṣā commentary by Sthiramati. Current_author 'Sthiramati' correctly names the commentator but omits the root-text author Vasubandhu whose work the title comments on.
SA_GP12_sivap	Śiva-Purāṇa	anonymous/traditional (attributed to Vyāsa)	anonymous (traditionally ascribed to Vyāsa)	anonymous	False	gretil-header; tradition	Traditional ascription to Vyāsa is legendary, applied generically to all Purāṇas; the work is anonymous and multi-layered. Current_author already records this correctly.
SA_GSP34_yogasubha	Yogasūtrabhāṣya	attributed to Vyāsa (Vedavyāsa); possibly Patañjali himself	Patañjali (modern consensus, as part of Pātañjalayogaśāstra); traditionally Vyāsa (Vedavyāsa)	disputed	False	gretil-header; secondary:cleaned_White_Yoga in Practice.txt; secondary:cleaned_Freschi and Maas_Adaptive Reuse.txt; web:elisafreschi.com; web:sahapedia.org	Disputed/pseudepigraphic: traditional ascription to Vyāsa (Vedavyāsa) is post-1100 CE and rejected by Maas, who argues the bhāṣya is Patañjali's own (unified Pātañjalayogaśāstra). Not a multi-author conflation but a contested single attribution. Current_author already flags both possibilities.
SA_K12_bsu012_u	Bhaiṣajyaguruvaidūryaprabharājasūtra	anonymous/traditional	anonymous	anonymous	False	gretil-header; secondary:cleaned_Indian Buddhism. A Survey_Nakamura, 1980.txt	Anonymous Mahāyāna sūtra; only later translators (Buddha) named, not authors. Current_author correct.
