id	title	current_author	primary_author	attribution_status	conflation	source	note
SA_T04_tat	Tattvasaṃgraha	Śāntarakṣita	Śāntarakṣita (kārikā/root verses); commentary Pañjikā by Kamalaśīla (not in this e-text)	secure	False	gretil-header	Root Tattvasaṃgraha verses by Śāntarakṣita; the famous Pañjikā commentary is by his pupil Kamalaśīla. This particular e-text is the root only (so single author for the digital file), but the work/edition is conventionally a verse+Pañjikā pair. Kamalaśīla listed for completeness; conflation_flag=false because this file is root-only.
SA_T01_n829u	Saptavidhānuttarastotra	anonymous/traditional	anonymous	anonymous	False	gretil-header; secondary:cleaned_LVP_Bouddhisme_études et matériaux.txt; web:https://www.wisdomlib.org/definition/saptavidhanuttarapuja	Anonymous Buddhist devotional stotra tied to the sevenfold-worship liturgy; no original author named, only modern editor Pandey. Already marked anonymous/traditional. No author invented.
SA_T01_n812u	Avadhānastotra [Vandanāstava]	anonymous/traditional	anonymous	anonymous	False	gretil-header; web:https://sanskritdocuments.org/iast/stotra/	Anonymous Buddhist vandanā-type stotra. Not to be confused with the Aṣṭamahāsthānacaityavandanastava traditionally ascribed to King Harṣa Śīlāditya (a distinct text, per Lamotte) — that ascription is NOT applied here to avoid mis-conflation. Already anonymous/traditional; unchanged.
SA_GR13_devikapu	Devīkālottara-Āgama	anonymous/traditional (revealed scripture)	anonymous (revealed Śaiva āgama); commentary by Nirañjanasiddha	anonymous	False	gretil-header	Root verses anonymous revealed āgama; commentary (not in GRETIL mūla file) by Nirañjanasiddha. Roots vs commentary are different hands but the GRETIL text is mūla-only, so no in-text conflation.
SA_MB_RudraYamalaHK	Rudrayāmalatantra (Uttarakāṇḍa)	anonymous/traditional	anonymous (revealed Tantra, Śiva–Śakti dialogue)	anonymous	False	secondary:cleaned_History of the Tantric Religion An Historical, Ritualistic, and Philosophical Study_N. N. Bhattacharyya 2006.txt	No named author; pseudo-quotations from 'Rudrayāmala' are common, the work itself is an anonymous, layered revealed Tantra. Editor Jīvānanda Vidyāsāgara is publisher, not author.
SA_MB_aryamanjusrimulakalpa2HK	Āryamañjuśrīmūlakalpa, Part 2	anonymous (Mahāyāna/Mantrayāna compilation)	anonymous (layered Mahāyāna–Mantrayāna compilation)	anonymous	False	secondary:cleaned_Indian Buddhism. A Survey With Bibliographical Notes_Hajime Nakamura, 1980.txt	Stratified anonymous compilation accreting over centuries; chronologically composite but no distinct NAMED authors, so anonymous rather than conflated. T. Ganapati Sastri = editor.
SA_GS40_vagaah_u	Aṣṭāṅgahṛdayasūtra (Aṣṭāṅgahṛdaya, Sūtrasthāna)	Vāgbhaṭa	Vāgbhaṭa	secure	False	secondary:cleaned_Maas_Indian Medicine and Ayurveda.txt	AH securely by Vāgbhaṭa (the GS40 file is the mūla Sūtrasthāna). The 'two Vāgbhaṭas' question is about the relation of AH to the Aṣṭāṅgasaṅgraha, not a conflation within this title. Commentators are distinct later hands but not in the mūla text.
SA_K12_Āgama_Mañjuśrīmūlakalpa_Shastri_1925	Āryamañjuśrīmūlakalpa (DSBC, ed. T. Ganapati Śāstrī)		anonymous (layered Mahāyāna–Mantrayāna compilation)	anonymous	False	web:https://www.dsbcproject.org/canon-text/book/78	Work-item had empty title/author; identified as the Āryamañjuśrīmūlakalpa (TSS 70/76/84, Ganapati Śāstrī ed.). Anonymous compilation; Ganapati Śāstrī = editor only, not author.
SA_MB_aryamanjusrimulakalpa3HK	Āryamañjuśrīmūlakalpa, Part 3	anonymous (Mahāyāna/Mantrayāna compilation)	anonymous (layered Mahāyāna–Mantrayāna compilation)	anonymous	False	secondary:cleaned_Indian Buddhism. A Survey With Bibliographical Notes_Hajime Nakamura, 1980.txt	Same work as parts 2 and the DSBC edition; anonymous composite text, no named author. Editor = T. Ganapati Sastri.
SA_T03_n1146u	Abhisamayālaṃkārāloka [Abhisamayālaṅkārāloka]	Haribhadra	Haribhadra (vyākhyā); on Maitreya's Abhisamayālaṃkāra kārikā + the Aṣṭasāhasrikā sūtra	conflated	True	secondary:cleaned_Snellgrove_Indo-Tibetan Buddhism.txt; secondary:cleaned_NAGARJUNA'S PHILOSOPHY OF SUNYATA AND HIS DIALECTIC_SHOHEI ICHIMURA, 1972.txt	Commentary genuinely structured around another author's verses: the kārikā = Abhisamayālaṃkāra (Maitreya, transmission assoc. Asaṅga), the running commentary/ālokā = Haribhadra (8th c.). Haribhadra authorship of the ālokā itself is secure.
SA_MB_parakramapujaHK	parākramapūjā	anonymous/traditional	anonymous	anonymous	False	web:https://list.indology.info/pipermail/indology/2014-November/040226.html	Modern editor (Dyczkowski) only; no original author named. Title is a ritual-section heading, not an authored work. Traditional ascription, if any, would be scriptural/revelatory.
SA_MB_taaraatantramHK	Tāratantra	anonymous/traditional (revelation; Śiva-Devī dialogue)	anonymous (revealed Śākta tantra; framed as Śiva-Devī dialogue)	anonymous	False	web:https://archive.org/details/in.ernet.dli.2015.281212; tradition	Editor A. K. Maitra (Akshaya Kumar Maitra) is modern; original author anonymous. Traditional ascription = revelation (Śiva to Devī). Not the Buddhist Tārā-mūla-kalpa, a distinct Śākta Tāratantra.
SA_T04_bsa003_u	Bodhicaryāvatāra [Bodhisattvacaryāvatāra]	Śāntideva	Śāntideva	secure	False	gretil-header; secondary:cleaned_MORAL THEORY IN SANTIDEVA'S SIKSASAMUCCAYA_Barbra R. Clayton.txt	Authorship secure. A shorter Dunhuang recension exists (canonical vs Dunhuang versions differ), but both ascribed to Śāntideva; commentary (Pañjikā) by Prajñākaramati is a separate work, not conflated here.
SA_GK21_brkas_pu	Bṛhatkathāślokasaṃgraha	Budhasvāmin	Budhasvāmin (Buddhasvāmin)	secure	False	gretil-header; secondary:cleaned_Przyluski_Les vidyārāja.txt	Budhasvāmin is author of this saṃgraha. Underlying narrative tradition is Guṇāḍhya's lost Bṛhatkathā (different source-author), but the extant Sanskrit text is Budhasvāmin's; no in-text conflation.
SA_GR12_hsasvrpu	Śāstravārtāsamuccaya	Haribhadrasūri	Haribhadrasūri	secure	False	gretil-header; secondary:cleaned_Buddhahood and Philosophy of Mind ... Tomlinson, 2019.txt	Jain Haribhadrasūri (8th c.), distinct from the Buddhist Haribhadra of item 1. Self-named in colophon. Sub-commentaries by others not conflated into this root text.
SA_T04_santbcpu	Bodhicaryāvatāra [Bodhisattvacaryāvatāra]	Śāntideva	Śāntideva (kārikā/root); Prajñākaramati (pañjikā)	conflated	True	gretil-header; secondary:cleaned_Jnanagarbha on the Two Truths_Eckel 1987; secondary:cleaned_Indian Buddhism_Nakamura 1980; secondary:cleaned_MORAL THEORY IN SANTIDEVA'S SIKSASAMUCCAYA_Clayton	Root Bodhicaryāvatāra securely by Śāntideva (8th c.); edition adds Prajñākaramati's Pañjikā (10th c.). current_author lists only Śāntideva, omitting the commentator bundled in the edition title.
SA_MB_guhyasamaajatantraHK	Guhyasamājatantra	anonymous/traditional (revealed; traditionally ascribed to the Buddha/Vajradhara; sometimes associated with Asaṅga or with the mahāsiddha tradition)	anonymous (revealed tantra; traditionally ascribed to the Buddha/Vajradhara)	anonymous	False	secondary:cleaned_Capriles_Budd philosophical schools and rdzogs chen; secondary:cleaned_PIATS-06-Fagernes-1992-v2; tradition	Revealed scripture; traditionally ascribed to the Buddha/Vajradhara. Ārya-tradition figures (Nāgārjuna, Candrakīrti, etc.) are later interpreters, not the author. Remains anonymous historically.
SA_T11_bsa066_u	Nyāyapraveśapravṛtti	Haribhadrasūri	Haribhadrasūri (pravṛtti/vṛtti); Śaṅkarasvāmin (root Nyāyapraveśa)	conflated	True	gretil-header; secondary:cleaned_Indian Buddhism_Nakamura 1980; secondary:cleaned_Steinkellner_Buddhist Epistemological Tradition; secondary:cleaned_Tucci_Doctrines of Maitreya; secondary:cleaned_Studies in the Buddhistic Culture of India_Joshi	Pravṛtti (commentary) by Haribhadrasūri (the current_author); root Nyāyapraveśa by Śaṅkarasvāmin (formerly misattributed to Dignāga). Title conflates commentator and root author.
SA_GR13_mrgt4mpu	Mṛgendrāgama [Mṛgendratantra]: 4. Yogapāda	anonymous/traditional (revealed scripture)	anonymous (revealed Śaiva Siddhānta scripture)	anonymous	False	gretil-header; secondary:cleaned_Yoga Powers_Knut A. Jacobsen 2012; secondary:cleaned_Essais sur le rituel	Revealed Śaiva Siddhānta scripture; anonymous. Bhaṭṭa Nārāyaṇakaṇṭha (vṛtti, ca. 10th c.) is associated by tradition/edition but absent from this mūla-only GRETIL file.
SA_GR13_mrgt3mpu	Mṛgendrāgama [Mṛgendratantra]: 3. Caryāpāda	anonymous/traditional (revealed scripture)	anonymous (revealed Śaiva Siddhānta scripture)	anonymous	False	gretil-header; secondary:cleaned_Yoga Powers_Knut A. Jacobsen 2012; secondary:cleaned_Ritual and Speculation in Early Tantrism_Goudriaan ed	Revealed Śaiva Siddhānta scripture; anonymous. Bhaṭṭa Nārāyaṇakaṇṭha wrote the vṛtti (associated by edition/tradition); the root Caryāpāda itself has no human author.
SA_T06_n1290u	Bāhyārthasiddhikārikā	Śubhagupta	Śubhagupta	secure	False	secondary:cleaned_Indian Buddhism_Nakamura 1980; secondary:cleaned_ruegg_bka' gnad 8; secondary:cleaned_Logic, language, and reality_Matilal 1990	Securely by Śubhagupta (Bhadanta Śubhagupta, ca. 650-750, a Vaibhāṣika/Sautrāntika realist refuted by Śāntarakṣita-Kamalaśīla). Kārikā = root verses; single author.
SA_GK21_hitop_u	Hitopadeśa	Nārāyaṇa	Nārāyaṇa (compiler/recaster)	traditional	True	secondary:cleaned_Pancatantra. The Book of India's Folk Wisdom_Patrick Olivelle, 1999.txt	Nārāyaṇa is the recaster/compiler, not an original author: the bulk derives from the Pañcatantra tradition (its anonymous material/Viṣṇuśarman frame). Title thus conflates Nārāyaṇa's redaction with inherited Pañcatantra authorship; Nārāyaṇa otherwise nearly unknown, patron Dhavalacandra.
SA_MB_TridasadaamaratantresiddhikaaliistotramHK	Tridaśaḍāmaratantre Siddhikālīstotra	anonymous/traditional	anonymous (traditionally revealed by Śiva)	anonymous	False	web:https://www.wisdomlib.org/definition/damaratantra	Tantric stotra/dialogue framed as revelation of Śiva (Mahādeva). No human author; traditional ascription is to Śiva. Stays anonymous/traditional as currently recorded.
SA_T11_sbpramvu	Pramāṇavārttikaṭīkā	Śākyabuddhi	Śākyabuddhi	secure	False	secondary:cleaned_Pramāṇakīrtiḥ-Steinkellner 70th_v2.txt	Sub-commentary (ṭīkā) on Dharmakīrti's Pramāṇavārttika, comments on Devendrabuddhi's Pañjikā. Author Śākyabuddhi (a.k.a. Śākyamati), 7th-8th c.; attribution secure. Root verses are Dharmakīrti's (not the author of this ṭīkā).
SA_K10_bsu025_u	Nairātmyaparipṛcchāmahāyānasūtra	anonymous/traditional	anonymous (Buddhavacana)	anonymous	False	dsbc-header | web:http://www.dsbcproject.org/canon-text/book/51	Mahāyāna sūtra (a 'paripṛcchā' / question-dialogue). No human author; traditional ascription is Buddhavacana. Editor P. L. Vaidya is modern editor only, not author.
SA_MB_niruttaravadaHK	Niruttaravāda		anonymous (traditionally revealed by Śiva/Mahādeva)	anonymous	False	web:https://www.wisdomlib.org/definition/niruttaratantra	current_author was blank. A tantric 'niruttara' doctrine text framed as Śiva's revelation; no human author. Traditional ascription to Mahādeva/Śiva. Set to anonymous (was empty).
SA_MB_mrgendraHK	Mṛgendrāgama	anonymous/traditional	anonymous (revealed Śaiva āgama; commentaries by Nārāyaṇakaṇṭha & Rāmakaṇṭha)	conflated	True	secondary:cleaned_sanderson_Purity and power among brahmans.txt	Śaiva Siddhānta āgama: the mūla is anonymous/revealed (counted as part of the Kāmikāgama upāgama tradition, word of Śiva). The standard editions conflate it with commentaries by TWO different authors — Nārāyaṇakaṇṭha (Vidyā/Yoga) and Rāmakaṇṭha (Kriyā/Caryā). Roles separated; conflation flagged.
SA_T01_n878u	Śākyasiṃhastotra: viṣṇukṛtam	anonymous/traditional (framed as spoken by Viṣṇu)	anonymous (pseudepigraphically ascribed to Viṣṇu)	pseudepigraphic	False	gretil-header | secondary:cleaned_Indian Buddhism. A Survey With Bibliographical Notes_Hajime Nakamura, 1980.txt	Buddhastotra in praise of the Buddha (Śākyasiṃha). 'viṣṇukṛtam' is a divine-speaker frame (Viṣṇu as eulogist), hence pseudepigraphic; the real composer is anonymous. Tradition-internal ascription to Viṣṇu noted separately.
SA_GK19_mala	Mālatīmādhava	Bhavabhūti	Bhavabhūti (kāvya/nāṭaka); Jagaddhara (commentary, in this edition)	secure	False	secondary:cleaned_Penguin History of Early India_Romila Thapar, 2001.txt | gretil-header	Root prakaraṇa drama securely by Bhavabhūti; the commentary in this edition is by Jagaddhara (distinct person, role separated but not a conflation of the work's authorship).
SA_T17_n958u	Bauddhatantrakośa I	anonymous/traditional (compilation)	anonymous (modern compilation; input by Milan Shakya)	anonymous	False	gretil-header	Modern digital compilation (a glossary of tantric terms drawing on many sources). No single classical author; Milan Shakya is the modern editor/inputter, not the author. Anonymous compilation.
SA_T02_n2932u	Adhyātmasāraśataka [Adhyātmasāraśatakasaṭīka]		uncertain (śataka verses + ṭīkā, both unattributed in available sources)	uncertain	False	web:dsbcproject.org (no record) | secondary:cleaned_Literature about the Philosophical Systems and Indian Philosophy.txt	Title indicates verses (śataka) plus a ṭīkā (saṭīka), potentially two authorial layers, but no attribution could be triangulated; deliberately not inventing one. Possible homonym with a Jain/Advaita Adhyātmasāraśataka — not confirmed for this item.
SA_MB_madhyapii.thapujavidhiHK	Madhyapīṭhapūjāvidhi	anonymous/traditional	anonymous (Śaiva ritual manual / paddhati)	anonymous	False	web:muktabodha.org | gretil-header	Anonymous ritual prescription (pūjā-vidhi) preserved only in manuscript. No scribal or authorial name recovered; genuinely anonymous.
SA_MB_nisvasakarikatantramHK	Niśvāsakārikā	anonymous/traditional (revealed scripture)	anonymous (revealed Śaiva scripture, Niśvāsa corpus)	anonymous	False	web:publications.efeo.fr / tantric-studies.uni-hamburg.de | secondary:cleaned_Samdarshi_Sacred Feminine Imagery in Tantric Buddhism.txt	Anonymous āgamic/revealed Śaiva scripture (Niśvāsa corpus). Multiple recensional layers but no named authors; attributed by tradition to Śiva, hence treated as anonymous with revelatory framing.
SA_T01_n842u	Buddhagaṇḍīstava	attributed (traditionally) to Aśvaghoṣa or Āryadeva; uncertain	Aśvaghoṣa (traditional; alt. Āryadeva)	traditional	False	tradition | web:https://tibetanbuddhistencyclopedia.com/en/index.php?title=A%C5%9Bvagho%E1%B9%A3a	Single hymn; not multi-author. Traditional/legendary ascription to Aśvaghoṣa, with alternative Āryadeva; genuinely uncertain. Edited in Pandey, Bauddhastotrasaṃgraha 1994.
SA_T11_n1226u	Vādanyāyaṭīkā	Vinītadeva	Śāntarakṣita (Vipañcitārthā ṭīkā) on Dharmakīrti's Vādanyāya	conflated	True	gretil-header | web:https://encyclopediaofbuddhism.org/wiki/V%C4%81dany%C4%81ya | secondary:cleaned_Literature about the Philosophical Systems and Indian Philosophy.txt	current_author 'Vinītadeva' is WRONG for THIS text: the e-text/edition is Śāntarakṣita's Vipañcitārthā ṭīkā. Two distinct Vādanyāya commentaries exist (Śāntarakṣita's Vipañcitārthā vs Vinītadeva's ṭīkā); title conflates root verses (Dharmakīrti) + commentary (Śāntarakṣita).
SA_T02_n1426u	Tattvasiddhi	attributed to Śāntarakṣita (attribution debated)	Śāntarakṣita (attributed; disputed)	disputed	False	web:https://en.wikipedia.org/wiki/Tattvasiddhi | secondary:cleaned_Studies in the Buddhistic Culture of India_Lal Mani Josh.txt | secondary:cleaned_Pramāṇakīrtiḥ-Steinkellner 70th_v2.txt	Beware homonyms: distinct from Harivarman's *Tattvasiddhi (Satyasiddhiśāstra) and from Yoginī Cintā's Vyaktabhāvānugata-tattvasiddhi. This tantric Tattvasiddhi's ascription to Śāntarakṣita is debated (Steinkellner contra Lindtner).
SA_MB_svacchandapaddhatiHK	Cidānandanātha: Svacchandapaddhati	Cidānandanātha	Cidānandanātha	secure	False	gretil-header	Single-author Śaiva ritual paddhati; colophon-confirmed. Editor Sītalāprasād Upādhyāya is modern, not the author.
SA_T13_n3004u	Paścāttāpa		anonymous	anonymous	False	gretil-header | web:http://www.dsbcproject.org/canon-text/book/874	No author given on e-text; Russell Webb is the 2003 editor, not the author. Recorded as anonymous (was empty current_author).
SA_MB_mahaalak.smiidiipadaanavidhiHK	mahālakṣmīdīpadānavidhiḥ	anonymous/traditional	anonymous	anonymous	False	tradition | web:https://muktabodha.org/digital-library/	Anonymous ritual vidhi; no traditional personal ascription found. Consistent with current 'anonymous/traditional'.
SA_MB_jnanasaraHK	Jñānasāra	uncertain (multiple works share this title; e.g. Yaśovijaya for the Jain Jñānasāra)	Title conflates several distinct works: Yaśovijaya (Jain Jñānasāra); a post-Bhāvaviveka Madhyamaka author (Buddhist Jñānasārasamuccaya); and an anonymous/Śaiva Jñānasāra (Muktabodha)	conflated	True	secondary:cleaned_Literature about the Philosophical Systems and Indian Philosophy.txt; secondary:cleaned_Indian Buddhism..._Nakamura, 1980.txt; secondary:cleaned_Buddhism and Jainism_Sarao,Long 2017.txt	Bare title 'Jñānasāra' is ambiguous; Jain (Yaśovijaya, 17th c.), Buddhist (Jñānasārasamuccaya), and Śaiva works coexist. Muktabodha (source_url) = Śaiva recension. Disambiguation needed per edition.
SA_K01_n2894u	Saddharmapārājikā	anonymous/traditional	anonymous (canonical Vinaya/prātimokṣa material)	anonymous	False	gretil-header/dsbc + web:https://www.wisdomlib.org/definition/parajika	Pārājikā = Vinaya category, not a named author's work; transmitted anonymously. No personal attribution; matches current 'anonymous/traditional'.
SA_MB_satsahasrakalottaragamaHK	Ṣaṭsahasrakālottarāgama (Ṣaṭsāhasra Kālottara)	anonymous/traditional (revealed scripture)	anonymous (revealed Śaiva āgama; Kālottara/Kālajñāna recension)	anonymous	False	secondary:cleaned_Buddhist Forum 1991_T. Skorupski.txt + tradition	Revealed Śaiva āgama; the '6000' is a verse-count recension label, not authorship. Anonymous; matches current attribution.
SA_T01_n838u	Ṣaṭtriṃśatsaṃvarastuti	anonymous/traditional	anonymous (Buddhist stotra, Bauddhastotrasaṃgraha no. 77)	anonymous	False	gretil-header:sa_108-buddhist-stotras.htm	No author named in GRETIL/Bauddhastotrasaṃgraha for this stotra; J.S. Pandey is editor only. Anonymous, matches current.
SA_MB_makutaagama_viirasaivaHK	Makuṭāgama (Vīraśaiva recension)	anonymous/traditional (ascribed to revelation by the Tatpuruṣa face of Śiva)	anonymous (revealed Śaiva Siddhāntāgama; Vīraśaiva recension)	anonymous	False	web:https://www.wisdomlib.org/definition/makutagama + gretil-header (Muktabodha edition note)	Revealed āgama (Tatpuruṣa face of Śiva); anonymous. Gurukkal/Dyczkowski are editors of the e-text only. Matches current attribution.
SA_T11_n2848u	Bauddha manīṣā - Bauddheṣu Pramāṇamīmāṃsā		uncertain (modern Sanskrit treatise on Buddhist epistemology; named modern author not confirmed)	uncertain	False	web:https://www.dsbcproject.org/ (no confirmed author found)	Modern Sanskrit work on Buddhist pramāṇa; author name not verifiable from available sources. Left authors=[] pending confirmation; status=uncertain (a modern author exists but is unconfirmed). current_author was empty.
SA_T04_bsa047	Bhāvanākrama	Kamalaśīla	Kamalaśīla	secure	False	gretil-header; secondary:cleaned_Mipham Gyatso Rinpoche's 'Makeover' of Hwashang Moheyan (Tucci ed.)	Single author Kamalaśīla; colophon also names Tibetan reviewer/translators Prajñāvarman and Jñānasena (transmission roles, not co-authors).
SA_T02_n798u	Ḍākinījālasaṃvararahasya		Anaṅga Yogin (Anaṅgayogi)	traditional	False	secondary:cleaned_Davidson_Indian Esoteric Buddhism (p.261, n.62); web:exoticindiaart.com	Was blank; resolved to Anaṅga Yogin (ascribed). This is a tantric commentary/rahasya, distinct from the root Sarvabuddhasamāyoga-ḍākinījālasaṃvara-tantra.
SA_T01_n890u	Svayaṃbhūstava	anonymous/traditional	anonymous	anonymous	False	gretil-header; web:archive.org (Pandey 1994 collection description)	Buddhist Svayaṃbhū (Nepal) hymn; no author named in edition. NB: not the Jain Svayambhūstotra by Samantabhadra.
SA_T01_n871u	Nāmāṣṭaśataka	anonymous/traditional	anonymous	anonymous	False	gretil-header; secondary:cleaned_Gha rung pa...Lamp That Illuminates (cites Prajñāpāramitānāmāṣṭaśataka as scripture, no author)	Name-litany (aṣṭaśata) stotra; no author in edition; traditionally anonymous canonical text.
SA_T03_kamvchtu	Prajñāpāramitāvajracchedikāṭīkā	Kamalaśīla	Kamalaśīla (ṭīkā); Buddhavacana/anonymous (Vajracchedikā sūtra)	conflated	True	secondary:cleaned_Salistamba-sutra and its Indian Commentaries_Schoening (D 3817); web:dsbcproject.org/canon-text/content/76/633	Two distinct layers: root sūtra (anonymous Buddhavacana) vs ṭīkā by Kamalaśīla. Current attribution credits only Kamalaśīla; flagged as conflation of sūtra + commentary.
SA_T04_ksmadhlu	Madhyamakāloka	Kamalaśīla	Kamalaśīla	secure	False	gretil-header; secondary:cleaned_Literature about the Philosophical Systems (Keira); cleaned_Kuijp_Dating two ldeu chronicles	Single author Kamalaśīla; secure.
SA_T01_n868u	Buddhabhaṭṭārakastotra	anonymous/traditional	anonymous (colophon ascribes composition to Brahmā, legendary)	pseudepigraphic	False	gretil-header	Colophon names Brahmā as composer — pseudepigraphic divine ascription; genuine human author unknown. Differs from bare 'anonymous/traditional' by recording the specific legendary ascription.
SA_T14_bsu059_u	Samyaksambuddhabhāṣita Pratimālakṣaṇa	anonymous/traditional (ascribed to the Buddha's word)	anonymous (ascribed to the Buddha as buddhavacana; iconometric tradition also linked to Atreya/Mañjuśrī)	pseudepigraphic	False	gretil-header	Pseudepigraphic buddhavacana (Buddha to Śāriputra); no real author. Editors named but not authors. Atreya/Mañjuśrī appear only for the broader iconometry genre, not this text specifically.
SA_MB_kulanandadiHK	Kulānandādi	attributed to Matsyendranātha (traditional)	Matsyendranātha (traditional school ascription)	traditional	False	secondary:cleaned_YOGA, Immortality & Freedom_Mircea Eliade, 1954, 1958.txt	Traditional ascription to Matsyendranātha as eponymous founder of the Kaula school; authorship is school-level, not securely personal. No conflation evident in this short treatise.
SA_GSP31_tttvsamu	Tattvasamāsa	anonymous/traditional (ascribed to Kapila)	anonymous (traditionally — and per scholarship 'wrongly' — ascribed to Kapila)	pseudepigraphic	False	secondary:cleaned_Encyclopedia of Indian Philosophies, Vol. 4 - Potter 1987.txt	Anonymous; Kapila ascription explicitly called 'wrongly' attributed by Potter — hence pseudepigraphic to the legendary founder. The kārikā-text is distinct from its later commentaries (Kramadīpikā etc.), which have their own authors.
SA_K12_bsu003_u	Aparimitāyuḥsūtra	anonymous/traditional	anonymous (Mahāyāna sūtra ascribed to the Buddha as buddhavacana)	anonymous	False	gretil-header	Anonymous buddhavacana sūtra; no individual author. Buddha/Mañjuśrī are internal speakers, not historical authors; recorded as anonymous per instructions (no genuine author known).
SA_GSD36_ys-99_pu	Laghuyamasmṛti	anonymous/traditional (ascribed to Yama)	anonymous (Dharmaśāstra metrical smṛti traditionally ascribed to the sage/god Yama)	pseudepigraphic	False	tradition	Pseudepigraphic ascription to Yama (legendary lawgiver); a 'Laghu' recension distinct from the larger Yamasmṛti, both anonymous in real authorship. Recorded as pseudepigraphic rather than bare anonymous to capture the Yama ascription.
SA_K12_manjn1pu	Mañjuśrīnāmasaṃgīti	anonymous/traditional	anonymous (root tantra; traditionally Buddhavacana, Māyājālatantra cycle)	anonymous	False	gretil-header; web:https://en.wikipedia.org/wiki/Mañjuśrīnāmasamgīti	Root text anonymous/traditional Buddhavacana; do not conflate with Vilāsavajra's commentary. Colophon = compiler/editor only (Pandey), not authorship.
SA_MB_sakalaagamasaarasangrahaHK	Sakalāgamasārasaṅgraha	anonymous/traditional (compiler unidentified in available sources)	uncertain; traditionally ascribed to Nigamajñānadeśika (Śaiva Siddhānta, 16th c.) — unconfirmed for this title	uncertain	False	secondary:cleaned_skt-en-mono.txt; web:https://www.wisdomlib.org/hinduism/book/sivaprakasam-study/d/doc1210695.html	Śaiva Siddhānta āgama-digest; compiler not securely identified. Possible Nigamajñānadeśika but low confidence; treat as uncertain rather than firmly anonymous.
SA_K12_Āgama_Mañjuśrīnāmasaṃgīti_Mukherji_1963	Āryamañjuśrīnāmasaṃgīti (Mukherji 1963 ed.)		anonymous (root tantra; traditionally Buddhavacana)	anonymous	False	tradition; web:https://en.wikipedia.org/wiki/Mañjuśrīnāmasamgīti	current_author was empty; root NMS is anonymous/traditional. Mukherji = editor of Skt+Tib parallel texts, not author.
