id	title	current_author	primary_author	attribution_status	conflation	source	note
SA_MB_IPVV_3_hk	Abhinavagupta: Īśvarapratyabhijñāvivṛtivimarśinī, Volume 3	Abhinavagupta	Abhinavagupta (vivṛtivimarśinī); on Utpaladeva's kārikā + vivṛti	conflated	True	web:https://link.springer.com/article/10.1007/s10781-013-9213-4	Current record lists only Abhinavagupta. The title-complex conflates Utpaladeva (kārikā + the 'Aṣṭasāhasrī' vivṛti, mostly lost) with Abhinavagupta (vivṛtivimarśinī). Distinct from Abhinavagupta's separate Īśvarapratyabhijñāvimarśinī (on the kārikā alone).
SA_MB_vyasishthaDsthitiprakaranamHK	Yogavāsiṣṭha, Part 4, with the commentary Tātparyaprakāśa	attributed to Vālmīki (anonymous/composite); commentary by Ānandabodhendra Sarasvatī	Ānandabodhendra Sarasvatī (Tātparyaprakāśa); root text pseudo-Vālmīki (anonymous/composite)	conflated	True	secondary:cleaned_Literature about the Philosophical Systems and Indian Philosophy.txt	Root text: pseudo-Vālmīki, anonymous/composite (orig. Kashmirian Mokṣopāya). Commentary: Ānandabodhendra Sarasvatī. Two distinct authorial layers — conflation flagged.
SA_GR13_bijnighu	Bījanighaṇṭu	anonymous/traditional (ascribed to Bhairava)	anonymous (framed as teaching of Śiva, transmitted via Bhairava)	anonymous	False	gretil-header	No historical author. Traditional/divine ascription to Śiva (via Bhairava) noted but not a real authorship claim; remains anonymous.
SA_T02_vamvuppu	Mṛtyuvañcanopadeśa	Vāgīśvarakīrti	Vāgīśvarakīrti	secure	False	gretil-header	Secure: author named in repeated colophons (viracita). Vāgīśvarakīrti = Vikramaśīla scholar, c. 11th c.
SA_MB_YvaasisthaBmumuksuvyavaharaprakaranamHK	Yogavāsiṣṭha, Part 2, with the commentary Tātparyaprakāśa	attributed to Vālmīki (anonymous/composite); commentary by Ānandabodhendra Sarasvatī	Ānandabodhendra Sarasvatī (Tātparyaprakāśa); root text pseudo-Vālmīki (anonymous/composite)	conflated	True	secondary:cleaned_Literature about the Philosophical Systems and Indian Philosophy.txt	Root text pseudo-Vālmīki (anonymous/composite); commentary Ānandabodhendra Sarasvatī. Mumukṣuvyavahāra is the 2nd prakaraṇa. Two authorial layers — conflation flagged.
SA_MB_paratrimsikavivaranaHK	Parātrīśikāvivṛti (Parātrīśikā-laghuvṛtti)	Abhinavagupta	Abhinavagupta (laghuvṛtti/vivṛti); Parātrīśikā root verses anonymous (Trika tantra)	conflated	True	secondary:cleaned_Encyclopedia of Tantra. 5 volumes_Sadhu Santideva, 1999.txt; secondary:cleaned_Understanding Mantras_Harvey P. Alper, 1989.txt	Title conflates: anonymous scriptural Parātrīśikā root verses (concluding portion of a Trika/Rudrayāmala tantra) vs Abhinavagupta's laghuvṛtti commentary. Only the vṛtti is his.
SA_GSP30_abhiprvu	Īśvarapratyabhijñāvimarśinī	Abhinavagupta	Abhinavagupta (vimarśinī); Utpaladeva (kārikā)	conflated	True	gretil-header; secondary:cleaned_Literature about the Philosophical Systems and Indian Philosophy.txt	Kārikā by Utpaladeva; vimarśinī (the work itself) by Abhinavagupta, disciple-lineage of Utpaladeva via Lakṣmaṇagupta. Edition adds Bhāskara's Bhāskarī sub-commentary.
SA_MB_IPV_HK	Abhinavagupta: Īśvarapratyabhijñāvimarśinī	Abhinavagupta	Abhinavagupta (vimarśinī); Utpaladeva (kārikā)	conflated	True	gretil-header (parallel abhiprvu); secondary:cleaned_Literature about the Philosophical Systems and Indian Philosophy.txt	Kārikā by Utpaladeva; commentary (vimarśinī = the named work) by Abhinavagupta. Muktabodha/KSTS no. 22 & 33.
SA_MB_IPVV_2_hk	Abhinavagupta: Īśvarapratyabhijñāvivṛtivimarśinī, Volume 2	Abhinavagupta	Abhinavagupta (vivṛtivimarśinī); Utpaladeva (kārikā + vivṛti commented on)	conflated	True	secondary:cleaned_Ritual and Speculation in Early Tantrism ... Padoux 1992.txt; secondary:cleaned_skt-en-mono.txt	Three-layer text: Utpaladeva's kārikā, Utpaladeva's (now largely lost) vivṛti, and Abhinavagupta's vivṛtivimarśinī (the named work, KSTS 62). The work itself is Abhinavagupta's.
SA_T02_mrtvutsu	Mṛtyuvañcanopadeśatārāsādhana	Vāgīśvarakīrti	Vāgīśvarakīrti	secure	False	gretil-header; secondary:cleaned_YOSHIZAKI_Newar Buddhism.txt; secondary:cleaned_Emptiness that is Form ... Yarnall.txt	Single-author Buddhist death-cheating Tārā sādhana. Attribution to Vāgīśvarakīrti secure per critical edition.
SA_GSP33_yaissi_u	Siddhitraya: Part 2: Īśvarasiddhi	Yāmuna (Yāmunācārya)	Yāmuna (Yāmunācārya)	secure	False	gretil-header; secondary:cleaned_Mimamsa and Vedanta ... Bronkhorst 2007.txt; secondary:cleaned_skt-en-mono.txt	Root Īśvarasiddhi by Yāmuna (secure); the three siddhis survive only as fragments. Edition/file also carries Kṛṣṇamācārya's Siddhāñjana commentary — distinct author, not conflated into the root attribution.
SA_MB_sattrimsattattvasamdohaHK	Ṣaṭtriṃśattattvasandoha	Amṛtānanda(nātha) (attributed; sometimes given as Rājānaka Ananda)	Amṛtānanda(nātha) (mūla kārikā); Rājānaka Ānanda (vivaraṇa)	conflated	True	secondary:cleaned_Encyclopedia of Indian Philosophies, Vol. 1 - Potter.txt; secondary:cleaned_Literature about the Philosophical Systems and Indian Philosophy.txt	Mūla (Trika/Kashmir Śaiva 36-tattva compendium) by Amṛtānandanātha; vivaraṇa by Rājānaka Ānanda — two distinct persons. Edition (KSTS, ed. Mukunda Rāma Shāstrī) prints both.
SA_T03_bsa051_u	Sāratamā [āryāṣṭasāhasrikāyāḥ prajñāpāramitāyāḥ sāratamākhyā pañjikā]	Ratnākaraśānti (Śāntipā)	Ratnākaraśānti	secure	False	gretil-header; secondary:cleaned_Sanskrit Texts from Giuseppe Tucci's Collection. Part I_Francesco Sferra.txt; secondary:cleaned_Drewes_Oral_Texts_in_Indian_Mahayana.txt	Single-author pañjikā commenting on the Aṣṭasāhasrikā (root sūtra is anonymous Mahāyāna scripture, not co-author of this work). Variant titles Sāratarā/Sārottamā noted by Drewes.
SA_T12_n801u	Chandoratnākara	Ratnākaraśānti (Śāntipa)	Ratnākaraśānti	secure	False	secondary:cleaned_Sanskrit Texts from Giuseppe Tucci's Collection. Part I_Francesco Sferra.txt; secondary:cleaned_Epperson_Kālidāsa in Tibet_Messenger Poetry in Translation.txt	Metrics treatise with svopajña (auto-)commentary; verses + vṛtti both Ratnākaraśānti's.
SA_T12_n2957u	Vṛttamālāstuti	Jñānaśrīmitra	Jñānaśrīmitra	secure	False	gretil-header; secondary:cleaned_Epperson_Kālidāsa in Tibet_Messenger Poetry in Translation.txt	Colophon names Jñānaśrīmitra. The e-text is the stuti (verses) only; Śākyarakṣita's Vṛttamālāvivṛti commentary is separate and not conflated here.
SA_GSP28_dhebta_u	Hetubinduṭīkāloka	Durveka Miśra	Durveka Miśra (Āloka); Bhaṭṭa Arcaṭa (Hetubinduṭīkā); Dharmakīrti (Hetubindu mūla)	conflated	True	gretil-header; secondary:cleaned_Indian Buddhism. A Survey With Bibliographical Notes_Hajime Nakamura, 1980.txt; secondary:cleaned_Introduction to Buddhist Philosophy...Tarkabhasa of Moksakaragupta_Kajiyama, 1966.txt	Title is the Āloka by Durveka Miśra, but the e-text/edition embeds three authors' strata: Dharmakīrti's Hetubindu (mūla), Arcaṭa's ṭīkā, Durveka's Āloka sub-commentary. current_author captures only Durveka.
SA_GK17_jvrtmspu	Vṛttamālāstuti	Jñānaśrīmitra	Jñānaśrīmitra	secure	False	gretil-header; secondary:cleaned_Epperson_Kālidāsa in Tibet_Messenger Poetry in Translation.txt	Duplicate work-item of the Vṛttamālāstuti (same file). Single author Jñānaśrīmitra; Śākyarakṣita's separate vivṛti not in this e-text.
SA_T04_bsa039_u	Daśākuśalakarmapathadeśanā	Atiśa Dīpaṃkaraśrījñāna	Atiśa Dīpaṅkaraśrījñāna	secure	False	gretil-header	Composed by Atiśa; colophon also names monk Jayaśīla as transmitter/editor (anūditaḥ sampāditaśca), a redactional role, not a co-author.
SA_T04_bsa036_u	Śaraṇagamanadeśanā	Atiśa Dīpaṃkaraśrījñāna	Atiśa Dīpaṅkaraśrījñāna	secure	False	gretil-header	Secure single-author work of Atiśa; no commentary layer.
SA_T04_bsa008_u	Garbhasaṅgraha	attributed to Nāgārjuna (traditional)	Atiśa Dīpaṅkaraśrījñāna (per Negi ed. & colophon)	disputed	False	secondary:cleaned_Atisa Dipamkara  Illuminator of the Awakened Mind_James B  Apple, 2019.txt	current_author records a traditional Nāgārjuna ascription, but the edition's colophon and modern scholarship (Negi 1992; Apple 2019) assign it to Atiśa/Dīpaṅkaraśrījñāna. Attribution is therefore disputed; best display author = Atiśa.
SA_MB_kubjikaatantramHK	Kubjikātantra	anonymous/traditional	anonymous (revealed scripture)	anonymous	False	web:https://archive.org/stream/TheCanonOfTheSaivagamaAndTheKubjikaTantrasOfTheWesternKaula/Canonaivgama_djvu.txt	Anonymous āgamic/tantric revelation; traditionally ascribed to Śiva. No individual author; sources do not single out a redactor by name.
SA_T04_bsa035_u	Bodhisattvādikarmikamārgāvatāradeśanā	Atiśa Dīpaṃkaraśrījñāna	Atiśa Dīpaṅkaraśrījñāna	secure	False	gretil-header	Authored by Atiśa; colophon adds Jayaśīla as transmitter/editor (anūditā), a redactional role only.
SA_MB_suprabhedagamaHK	Suprabhedāgama	anonymous/traditional (revelation ascribed to Śiva)	anonymous (revealed scripture)	anonymous	False	secondary:cleaned_Sanderson_The Śaiva Age.txt	Anonymous revealed āgama; revelation ascribed to Śiva. No human author; composite/redacted over time but no named layers in sources.
SA_T02_Mañjuśrīyaśa_Laghukālacakratantra-Vimalaprabhā-Vol2_Dwivedi-Bahulkar_1994	Vimalaprabhāṭīkā on Śrī-Laghukālacakratantra (Vol. 2)		Kalkin Śrīpuṇḍarīka (Vimalaprabhā ṭīkā); Mañjuśrīyaśas (Laghukālacakratantra mūla)	pseudepigraphic	True	gretil-header | web:https://en.wikipedia.org/wiki/Vimalaprabha	Two distinct (legendary) authors conflated under one volume: mūla tantra by Mañjuśrīyaśas, ṭīkā (Vimalaprabhā) by Kalki Śrīpuṇḍarīka. Ascriptions are Shambhala-lineage/pseudepigraphic; actual composition Indian, c. 11th c.
SA_MB_suksmagamaHK	Sūkṣmāgama	anonymous/traditional	anonymous (Śaiva Siddhānta āgama)	anonymous	False	gretil-header | tradition	Revealed Śaivasiddhānta āgama; traditionally Śiva's teaching, no human author. Sambandhaśivācārya/Ganesan are modern editors, not authors. Remains anonymous.
SA_MB_tejobinduupanisatHK	Tejobindu Upaniṣad	anonymous/traditional	anonymous (with commentary of Upaniṣad-Brahmayogin)	anonymous	False	secondary:cleaned_White_Yoga in Practice.txt | secondary:cleaned_Encyclopedia of Indian Philosophies, Vol. 1 - Potter.txt	Mūla Upaniṣad anonymous; commentary by Upaniṣad-Brahmayogin (distinct, datable person). Edition conflates anonymous root with named commentator, but root text stays anonymous.
SA_T02_Vajragarbha_Ṣaṭsāhasrikā-Hevajratantra_Shendge_2004	Ṣaṭsāhasrikā Hevajraṭīkā		Vajragarbha (ṭīkā on Hevajratantra)	traditional	False	gretil-header | web:https://www.exoticindiaart.com/book/details/sat-sahasrika-hevajratika-nao997/	Commentary (ṭīkā) on the Hevajratantra, not the tantra itself. Ascribed to Vajragarbha (the tantra's own interlocutor) — traditional ascription; editor flags doubt over later-chapter authorship.
SA_T02_Vajrapāṇi_Laghutantraṭīkā_Cicuzza_2001	Laghutantraṭīkā		Vajrapāṇi (Laghutantraṭīkā on Cakrasaṃvaratantra)	traditional	False	gretil-header | web:https://tibetanbuddhistencyclopedia.com/en/index.php/The_Laghutantra%E1%B9%AD%C4%ABk%C4%81_by_Vajrap%C4%81%E1%B9%87i	Commentary on Cakrasaṃvaratantra ch.1 by Vajrapāṇi (a human author using the bodhisattva name/persona). Not a root tantra. Single author.
SA_T02_Mañjuśrīyaśa_Laghukālacakratantra-Vimalaprabhā-Vol3_Dwivedi-Bahulkar_1994	Vimalaprabhāṭīkā on Śrī-Laghukālacakratantra (Vol. 3)		Kalkin Śrīpuṇḍarīka (Vimalaprabhā ṭīkā); Mañjuśrīyaśas (Laghukālacakratantra mūla)	pseudepigraphic	True	gretil-header | web:https://en.wikipedia.org/wiki/Vimalaprabha	Conflates two (legendary) authors: mūla tantra by Mañjuśrīyaśas, ṭīkā (Vimalaprabhā) by Kalki Śrīpuṇḍarīka. Pseudepigraphic Shambhala ascriptions; vol. 3 of same edition as the vol. 2 item.
SA_T02_Nāropā_Sekoddeśaṭīkā_Carelli_1941	Sekoddeśaṭīkā (Paramārthasaṃgraha)		Nāḍapāda / Nāropa (ṭīkā); root Sekoddeśa = anonymous Kālacakra tantra (traditionally Buddha-spoken)	conflated	True	secondary:cleaned_Newman_Brief History Kalachakra.txt; secondary:cleaned_Buddhist Thought_Williams Tribe Wynne 2000.txt; edition (Carelli 1941)	Two layers: root Sekoddeśa (anonymous tantric root, traditionally Bhagavān/Sucandra) commented on by Nāropa in the ṭīkā (Paramārthasaṃgraha). current_author empty; set Nāropa as ṭīkā author and flag conflation with anonymous root.
SA_MB_SPANDASAMDOHA_hk	Spandasandoha	Kṣemarāja	Kṣemarāja	secure	False	secondary:cleaned_History of the Tantric Religion_Bhattacharyya 2006.txt; secondary:cleaned_Encyclopedia of Indian Philosophies Vol.1 - Potter.txt	Secure: Kṣemarāja (pupil of Abhinavagupta), early 11th c. Pratyabhijñā/Spanda lineage. Single author.
SA_T11_bsa0552u	Kṣaṇabhaṅgasiddhi	Ratnakīrti	Ratnakīrti	secure	False	gretil-header; edition (Thakur, Ratnakīrtinibandhāvalī)	Colophon-attested to Ratnakīrti (11th c., Vikramaśīla, pupil of Jñānaśrīmitra). Single author, no commentary layer in this file.
SA_T11_bsa0551u	Apohasiddhi	Ratnakīrti	Ratnakīrti	secure	False	gretil-header; edition (Thakur, Ratnakīrtinibandhāvalī)	Colophon-attested to Ratnakīrti (11th c.). Scribe Trailokyadata is copyist, not author. Single author.
SA_T02_mrtvstsu	Mṛtyuvañcanasitatārāsādhana	anonymous/traditional (within the circle of Vāgīśvarakīrti's Mṛtyuvañcana cycle)	Vāgīśvarakīrti (source teaching); sādhana itself anonymous/redactional within his Mṛtyuvañcana cycle	traditional	False	gretil-header; edition (Schneider 2010)	Text self-references Vāgīśvarakīrti as the source authority; sādhana (SM 103) is a derivative ritual text within his Mṛtyuvañcana cycle. Promotes from 'anonymous/traditional' to traditional ascription to Vāgīśvarakīrti (medium confidence — sādhana may be redactional rather than autograph).
SA_T02_narsekou	Sekoddeśa [Sekoddeśaṭīkā]	Nāropa (Nāḍapāda)	anonymous (root Sekoddeśa, Kālacakra root tantra, traditionally Buddha-spoken); Nāropa only for the ṭīkā	conflated	True	gretil-header; secondary:cleaned_Newman_Brief History Kalachakra.txt	Title conflates the anonymous root Sekoddeśa with Nāropa's ṭīkā. current_author 'Nāropa' is wrong for the root verses present in this file (which are the Kālacakra root section). Flag conflation; root = anonymous, ṭīkā = Nāropa.
SA_T13_davyasou	Yaśodharācarita	Davuldeṇa Jñāneśvara (Davuldena Gnanissara) Mahāsthavira	Davuldeṇa Jñāneśvara (Davuldena Gnanissara) Mahāsthavira	secure	False	web:https://en.wikipedia.org/wiki/Davuldena_Gnanissara_Thero	Modern named author; not the medieval Yaśodhara legend versions (Vādirāja Sūri, Puṣpadanta's Jasaharacariu) mentioned in Winternitz.
SA_T02_bsa005_u	Caryāsaṅgrahapradīpa	Atiśa Dīpaṃkaraśrījñāna	Dīpaṅkaraśrījñāna (Atiśa) per colophon; attributed to (tantric) Āryadeva in Tibetan tradition	disputed	False	gretil-header; secondary:cleaned_Ontology of Consciousness. Percipient Action_Helmut Wautischer, ed., 2008.txt	Sanskrit text per colophon is Atiśa's; but the title is widely cited as Āryadeva's (tantric Āryadeva of the Guhyasamāja Ārya school). Same title, competing authorial ascriptions; not a single secure attribution.
SA_GSP30_ksembodhv_u	Bodhavilāsa	Kṣemarāja	Attributed to Kṣemarāja in transmitted colophon; scholarship reassigns to Vāmanadatta (= Dvayasampatti)	disputed	False	gretil-header; secondary:cleaned_skt-en-mono.txt	Title transmitted under Kṣemarāja's name (Pensa's ed.) but scholarly identification with the Dvayasampatti points to Vāmanadatta; attribution to Kṣemarāja is doubtful.
SA_T11_bsa0553u	Kṣaṇabhaṅgasiddhi vyatirekātmikā	Ratnakīrti	Ratnakīrti	secure	False	gretil-header; secondary:cleaned_Introduction to Buddhist Philosophy...Tarkabhasa of Moksakaragupta_Kajiyama 1966.txt	Author secure (Ratnakīrti, 11th c.); the work is a digest based on Jñānaśrīmitra's Kṣaṇabhaṅgādhyāya, but authorship of this redaction is Ratnakīrti's own.
SA_GSP30_sa_kSemarAja-bhairavAnukaraNastotra	Bhairavānukaraṇastotra	Kṣemarāja	Kṣemarāja	secure	False	gretil-header; web:east-and-west Gnoli 1958	Stotra securely ascribed to the Kashmir Śaiva Kṣemarāja (pupil of Abhinavagupta), per colophon and editor.
SA_GSP30_pratyabu	Pratyabhijñāhṛdaya	Kṣemarāja	Kṣemarāja (sūtras and auto-commentary/vṛtti)	secure	False	gretil-header; secondary:cleaned_Ritual and Speculation in Early Tantrism...Padoux_Goudriaan 1992.txt	Single author Kṣemarāja for both sūtras and auto-commentary; a summary of Pratyabhijñā doctrine drawing on Abhinavagupta, but not a multi-author conflation.
SA_T04_bsa038_u	Sūtrārthasamuccayopadeśa	Atiśa Dīpaṃkaraśrījñāna	Atiśa Dīpaṃkaraśrījñāna (author); Jayaśīla (editor/revisor)	secure	False	gretil-header	Colophon names Atiśa as composer; Jayaśīla as scholarly reviser/finalizer (saṃśodhaka), a redactional role only.
SA_MB_pratyabhijnahrdayaHK	Pratyabhijñāhṛdaya (text version)	Kṣemarāja	Rājānaka Kṣemarāja	secure	False	secondary:cleaned_Ritual and Speculation in Early Tantrism. Studies in Honor of André Padoux_Teun Goudriaan, ed, 1992.txt	Single author; the work is a summary of Pratyabhijñā doctrine by Kṣemarāja with his own auto-vṛtti (not transmitted in this text-only version).
SA_MB_spandanirnayaHK	Spandanirṇaya	Kṣemarāja	Kṣemarāja (Spandanirṇaya commentary); Vasugupta or Kallaṭa (Spandakārikā root verses, disputed)	conflated	True	secondary:cleaned_Sanderson_Śaivism and the tantric traditions.txt; gretil-header	Two distinct authorial layers: root Spandakārikā (Vasugupta vs Kallaṭa, disputed) + Spandanirṇaya commentary (Kṣemarāja). Title/current_author conflate the commentator with the unnamed kārikā author.
SA_MB_sivasuutravimarsiniiHK	Śivasūtravimarśinī (text version) [commentary on the Śivasūtra revealed to Vasugupta]	Śivasūtra revealed to/by Vasugupta; Vimarśinī commentary by Kṣemarāja	Kṣemarāja (Vimarśinī commentary); Śivasūtra traditionally revealed (ascribed to Śiva, 'discovered' by Vasugupta)	conflated	True	secondary:cleaned_Sanderson_Śaivism and the tantric traditions.txt; web:https://en.wikipedia.org/wiki/Shiva_Sutras_of_Vasugupta	Śivasūtra is traditionally revealed (counted as Āgama, ascribed to Śiva via Vasugupta) — not a securely human-authored root; Vimarśinī commentary securely by Kṣemarāja. Root listed as anonymous with traditional ascription noted.
SA_T04_bsa004_u	Bodhipathapradīpa	Atiśa Dīpaṃkaraśrījñāna	Atiśa Dīpaṃkaraśrījñāna	secure	False	gretil-header; web:https://en.wikipedia.org/wiki/Bodhipathaprad%C4%ABpa	Single author Atiśa; secure. Sanskrit original lost, reconstructed/preserved via Tibetan (Eimer ed.).
SA_T04_bsa024_u	Satyadvayāvatāranāma	Atiśa Dīpaṃkaraśrījñāna (Dīpaṃkara)	Atiśa Dīpaṃkaraśrījñāna (author); Vīryasiṃha (translator/reviser)	secure	False	gretil-header; web:https://link.springer.com/article/10.1007/s10781-013-9180-9	Atiśa is composer (viracita); Vīryasiṃha is translator/reviser (anūdya saṃśodhya nirṇītaḥ), not co-author. Sanskrit largely lost.
SA_MB_PARAAPRAAVESIKAA_hk	parāprāveśikā	Kṣemarāja	Kṣemarāja	secure	False	web:https://www.sanskrit-trikashaivism.com/en/para-praveshika-trika-scriptures-non-dual-shaivism-of-kashmir/394	Single-author Trika/Pratyabhijñā prose primer; securely Kṣemarāja, matches current_author.
SA_T14_stuplaku	Stūpalakṣaṇakārikāvivecana		Bhadravyūha (Ācārya, Lokottaravādin)	traditional	False	gretil-header	current_author empty -> Bhadravyūha per colophon. Roth = modern editor, not author. Title pairs verses (kārikā) and analysis (vivecana) but both ascribed to one author.
SA_GR14_astavgpu	Aṣṭāvakragītā	anonymous/traditional (attributed to Aṣṭāvakra)	anonymous (traditionally ascribed to the sage Aṣṭāvakra)	anonymous	False	web:https://en.wikipedia.org/wiki/Ashtavakra_Gita	Legendary/traditional ascription to Aṣṭāvakra is to the dialogue character, not a historical author; genuinely anonymous. Matches current_author intent.
SA_T02_garbhasamgraha	Garbhasaṃgraha	Atiśa Dīpaṃkaraśrījñāna (attributed)	Atiśa Dīpaṃkaraśrījñāna (attributed)	traditional	False	secondary:cleaned_Atisa Dipamkara  Illuminator of the Awakened Mind_James B  Apple, 2019.txt	Traditional ascription to Atiśa upheld; flag homonymous Kāṇha Garbhasaṃgraha as a separate work to avoid misidentification. Survives only in Tibetan translation.
SA_T02_Puṇḍarīka_Vimalaprabhā-Laghukālachakratantra_Upadhyaya_1986	Vimalaprabhāṭīkā on the Laghukālacakratantra (Upadhyaya ed. 1986)		Kalki Śrī Puṇḍarīka (Vimalaprabhā ṭīkā); Mañjuśrīyaśas (root Laghukālacakratantra)	conflated	True	web:https://www.tibetanbuddhistencyclopedia.com/en/index.php?title=Vimalaprabh%C4%81	Multi-author title: root tantra (Mañjuśrīyaśas) + ṭīkā (Puṇḍarīka) by different persons in the Kalkin lineage. current_author empty -> separated roles.
SA_T04_bsa040_u	Cittotpādasaṃvaravidhikrama	Atiśa Dīpaṃkaraśrījñāna	Atiśa Dīpaṃkaraśrījñāna	secure	False	gretil-header	Colophon names Atiśa as author plus two reviewers (redactors); matches current_author. Reviewers recorded as secondary roles, not a conflation of distinct authors.
SA_T04_bsa042_u	Gurukriyākrama	Atiśa Dīpaṃkaraśrījñāna	Atiśa Dīpaṃkaraśrījñāna	secure	False	secondary:cleaned_Introduction to the Buddhist Tantric Systems_Lessing & Wayman, 1968.txt; secondary:cleaned_Vetturini_Kadam School of TBism_vol2.txt	Toh. 3977; short ritual work, single author Atiśa. Confirmed by Tibetan colophon ascription 'jo bos mdzad pa'.
SA_MB_tattvaprakasaHK	Bhojadeva: Aṣṭaprakaraṇa — Tattvaprakāśa	Bhojadeva (King Bhoja of Dhārā, Paramāra dynasty)	Bhojadeva (Bhoja, Paramāra king of Dhārā)	secure	False	secondary:cleaned_Ritual and Speculation in Early Tantrism..._Goudriaan, 1992.txt; secondary:cleaned_Literature about the Philosophical Systems and Indian Philosophy.txt; secondary:cleaned_gavin-flood.txt	Root mūla (kārikā) text by Bhoja. The edition's commentaries (Tātparyadīpikā=Śrīkumāra, Vṛtti=Aghoraśiva) are separate works; the title here denotes the root, so no conflation for this item. Root authorship secure.
SA_T01_n910u	Vajrayoginyāḥ stutipraṇidhānam	anonymous/traditional	anonymous	anonymous	False	secondary:cleaned_English_Vajrayogini_Her Visualization, Rituals, and Forms.txt; web:https://www.wisdomlib.org/definition/guhyasamayasadhanamala	= Trikāyavajrayoginīstutipraṇidhāna / -stotra (GSS27). Part of anonymous GSS collection; remains anonymous. No traditional single ascription confirmed.
SA_T02_n1403u	Marmakālikā	anonymous/traditional	Vīryaśrīmitra (Marmakalikāpañjikā); root Tattvajñānasaṃsiddhi by Śūnyasamādhipāda	conflated	True	secondary:cleaned_Literature about the Philosophical Systems and Indian Philosophy.txt; web:WebSearch Tattvajnanasamsiddhi/Viryasrimitra	Title 'Marmakālikā' = the Marmakalikāpañjikā commentary by Vīryaśrīmitra; conflates root (mūla) Tattvajñānasaṃsiddhi of Śūnyasamādhipāda with the pañjikā of Vīryaśrīmitra. Was 'anonymous'; commentator now identified.
SA_T10_n3009u	Vimalaratnalekha	Atiśa Dīpaṅkara Śrījñāna	Atiśa Dīpaṃkaraśrījñāna	secure	False	secondary:cleaned_Indian Buddhism_Warder, 2000.txt; secondary:cleaned_Many Canons of Tibetan Buddhism 2_Eimer/Germano, 2002.txt; secondary:cleaned_Ehrhard_16 thig le and glegs bam.txt	Verse-epistle (lekha) of Atiśa addressed to King Nayapāla/Neyapāla. Single author, secure.
SA_T02_rabhramu	Bhramaharanāma Hevajrasādhana	Ratnākaraśānti (Śāntipā)	Ratnākaraśānti (Śāntipā)	secure	False	secondary:cleaned_Defining Wisdom. Ratnakarasanti's Saratama_Seton, 2015.txt; secondary:cleaned_Hevajra and Lam 'bras Literature_Sobisch, 2008.txt; edition:Isaacson 2002	Hevajra sādhana ('removing error/the bee'); single author Ratnākaraśānti. Tibetan translator uncertain (possibly Atiśa) but Sanskrit authorship secure.
SA_GK22_vidsripu	Subhāṣitaratnakoṣa	Vidyākara	Vidyākara (compiler/anthologist)	secure	False	gretil-header	Anthology: thousands of source poets cited per verse, but authorship of the WORK = compiler Vidyākara. Not a conflation in the multi-author-role sense; it is a koṣa (treasury) by definition citing many poets. vidsripu = unicode input version.
SA_GK22_vidsrgpu	Subhāṣitaratnakoṣa	Vidyākara	Vidyākara (compiler/anthologist)	secure	False	gretil-header	Duplicate work-record, corrected/revised e-text version of the Subhāṣitaratnakoṣa. Same compiler. Per-verse poets cited internally.
SA_T02_Advayavajra_saṃgraha_Bhattacharyya_1927	Advayavajrasaṃgraha		Advayavajra (= Maitrīpa)	traditional	False	web:https://en.wikipedia.org/wiki/Maitripada	Title field was empty; supplied 'Advayavajrasaṃgraha'. A single-author NAMED corpus (Advayavajra's collected short works), not a conflation of distinct authors; however attribution of some individual pieces within the 21 is uncertain (medium confidence). Advayavajra ≡ Maitrīpa ≡ Maitreyanātha (siddha).
